A1: Details of E-Journals Accessible in GGSIPU in 2013
A2: Sl. No. | B2: Publisher / | C2: List of Journals / Databases
A4: 1 | B4: ACM Digital Library | C4: 32
A5: =SUM(A4+1) -> 2 | B5: American Chemical Society | C5: 37
A6: =SUM(A5+1) -> 3 | B6: American Institute of Physics | C6: 15
A7: =SUM(A6+1) -> 4 | B7: Aluka | C7: 3
A8: =SUM(A7+1) -> 5 | B8: American Physical Society | C8: 11
A9: =SUM(A8+1) -> 6 | B9: Annual Reviews | C9: 40
A10: =SUM(A9+1) -> 7 | B10: Blackwell - Wiley | C10: 908
A11: =SUM(A10+1) -> 8 | B11: Cambridge University Press | C11: 224
A12: =SUM(A11+1) -> 9 | B12: Derwent Biotechnology Abstract | C12: 1
A13: =SUM(A12+1) -> 10 | B13: EBSCO Business Source Complete | C13: 1300
A14: =SUM(A13+1) -> 11 | B14: EBSCO Communication & Mass Media Complete | C14: 450
A15: =SUM(A14+1) -> 12 | B15: Emerald Management Extra | C15: 175
A16: =SUM(A15+1) -> 13 | B16: Hein Online | C16: 1
A17: =SUM(A16+1) -> 14 | B17: IEL Digital Library | C17: 278
A18: =SUM(A17+1) -> 15 | B18: Indian Standards- BIS | C18: 1
A19: =SUM(A18+1) -> 16 | B19: Institute of Physics | C19: 67
A20: =SUM(A19+1) -> 17 | B20: ISID Online Database | C20: 1
A21: =SUM(A20+1) -> 18 | B21: J-Gate Custom Content for Consortia | C21: 1
A22: =SUM(A21+1) -> 19 | B22: JSTOR | C22: 2585
A23: =SUM(A22+1) -> 20 | B23: Lexis-Nexis | C23: 1066
A24: =SUM(A23+1) -> 21 | B24: Manupatra | C24: 1
A25: =SUM(A24+1) -> 22 | B25: Nature Publishing Group | C25: 10
A26: =SUM(A25+1) -> 23 | B26: New Scientist | C26: 1
A27: =SUM(A26+1) -> 24 | B27: Oxford Journals | C27: 309
A28: =SUM(A27+1) -> 25 | B28: Project Muse | C28: 559
A29: =SUM(A28+1) -> 26 | B29: Royal Society of Chemistry | C29: 46
A30: =SUM(A29+1) -> 27 | B30: Sage (Communication & Media Studies Collection) | C30: 36
A31: =SUM(A30+1) -> 28 | B31: ScienceDirect | C31: 1609
A32: =SUM(A31+1) -> 29 | B32: SciFinder Scholar | C32: 1
A33: =SUM(A32+1) -> 30 | B33: Springer | C33: 2720
A34: =SUM(A33+1) -> 31 | B34: Taylor and Francis | C34: 1173
A35: =SUM(A34+1) -> 32 | B35: UIRC Subscribed including FOAP | C35: 341
A36: =SUM(A35+1) -> 33 | B36: Web of Science | C36: 1
A37: =SUM(A36+1) -> 34 | B37: West Law India | C37: 1
B38: Total Journals | C38: =SUM(C4:C37) -> 14004