A1: List of Journals Susbscribed for 2010
A2: 1 | B2: Academy Management Journal
A3: =1+ A2 -> 2 | B3: Academy Management Review
A4: =1+ A3 -> 3 | B4: Administrative Science Quarterly
A5: =1+ A4 -> 4 | B5: Advertising Age
A6: =1+ A5 -> 5 | B6: Afaqs Reporter
A7: =1+ A6 -> 6 | B7: AIChE Journal
A8: =1+ A7 -> 7 | B8: Akar
A9: =1+ A8 -> 8 | B9: Akshar Parv
A10: =1+ A9 -> 9 | B10: Alochana
A11: =1+ A10 -> 10 | B11: Alternatives
A12: =1+ A11 -> 11 | B12: American Scientist
A13: =1+ A12 -> 12 | B13: American Theatre
A14: =1+ A13 -> 13 | B14: Angewandte Chemie International
A15: =1+ A14 -> 14 | B15: Annals of Library and Information Studies
A16: =1+ A15 -> 15 | B16: Architectural Record
A17: =1+ A16 -> 16 | B17: Architectural Review
A18: =1+ A17 -> 17 | B18: Architecture and Design
A19: =1+ A18 -> 18 | B19: Art and Deal
A20: =1+ A19 -> 19 | B20: Art India
A21: =1+ A20 -> 20 | B21: Asian Journal of Water Environment and Pollution
A22: =1+ A21 -> 21 | B22: Banking Service Chronicle
A23: =1+ A22 -> 22 | B23: Biblio
A24: =1+ A23 -> 23 | B24: Bio Technique
A25: =1+ A24 -> 24 | B25: Bioinformatics
A26: =1+ A25 -> 25 | B26: Biomass & Bioenergy
A27: =1+ A26 -> 26 | B27: BioSpectrum
A28: =1+ A27 -> 27 | B28: Book Review
A29: =1+ A28 -> 28 | B29: Brittonia
A30: =1+ A29 -> 29 | B30: Business India
A31: =1+ A30 -> 30 | B31: Business Today
A32: =1+ A31 -> 31 | B32: Business Week
A33: =1+ A32 -> 32 | B33: Business World
A34: =1+ A33 -> 33 | B34: Cancer Research
A35: =1+ A34 -> 34 | B35: Capital Market
A36: =1+ A35 -> 35 | B36: Case Folio
A37: =1+ A36 -> 36 | B37: Chartered Finanical Analyst
A38: =1+ A37 -> 37 | B38: Chartered Secretary
A39: =1+ A38 -> 38 | B39: Chemical Business
A40: =1+ A39 -> 39 | B40: Chemical Engineering
A41: =1+ A40 -> 40 | B41: Chemical Engineering Education
A42: =1+ A41 -> 41 | B42: Chemical Engineering Progress
A43: =1+ A42 -> 42 | B43: Chemical Engineering Research and Design
A44: =1+ A43 -> 43 | B44: Chemical Engineering Science
A45: =1+ A44 -> 44 | B45: Chemical Engineering World
A46: =1+ A45 -> 45 | B46: Chemical Industry Digest
A47: =1+ A46 -> 46 | B47: Chemical Weekly
A48: =1+ A47 -> 47 | B48: Chemistry - A European Journal
A49: =1+ A48 -> 48 | B49: Chemistry & Industry
A50: =1+ A49 -> 49 | B50: Cine Action
A51: =1+ A50 -> 50 | B51: Cinema Journal
A52: =1+ A51 -> 51 | B52: Civil Engineering & Construction
A53: =1+ A52 -> 52 | B53: Clinical Cancer Research
A54: =1+ A53 -> 53 | B54: College & Research Libraries
A55: =1+ A54 -> 54 | B55: COLLNET Journal of Scientometrics and Information Management
A56: =1+ A55 -> 55 | B56: Columbia Journalism Review
A57: =1+ A56 -> 56 | B57: Comparative Literature
A58: =1+ A57 -> 57 | B58: Competition Affairs
A59: =1+ A58 -> 58 | B59: Competition Sucess Review
A60: =1+ A59 -> 59 | B60: Computer Journal
A61: =1+ A60 -> 60 | B61: Construction Journal of India
A62: =1+ A61 -> 61 | B62: Creative Forum
A63: =1+ A62 -> 62 | B63: CSI Communication
A64: =1+ A63 -> 63 | B64: CSIR News
A65: =1+ A64 -> 64 | B65: Current Science
A66: =1+ A65 -> 65 | B66: Decision
A67: =1+ A66 -> 66 | B67: Derwent Biotechnology Abstracts on CD
A68: =1+ A67 -> 67 | B68: DESIDOC Bulletin of Information Technology
A69: =1+ A68 -> 68 | B69: Detail: Journal of Architecture
A70: =1+ A69 -> 69 | B70: Digit
A71: =1+ A70 -> 70 | B71: Down to Earth
A72: =1+ A71 -> 71 | B72: Economic and Political Weekly
A73: =1+ A72 -> 72 | B73: Economic Intelligent Services
A74: =1+ A73 -> 73 | B74: Economist
A75: =1+ A74 -> 74 | B75: ELLE Decor
A76: =1+ A75 -> 75 | B76: EMBO Journal
A77: =1+ A76 -> 76 | B77: EMBO Reports
A78: =1+ A77 -> 77 | B78: Energy Conversion and Management
A79: =1+ A78 -> 78 | B79: Environmental Engineeering
A80: =1+ A79 -> 79 | B80: Environmental Progress & Sustainable Energy
A81: =1+ A80 -> 80 | B81: Environmental Science and Engineering
A82: =1+ A81 -> 81 | B82: Environmetrics
A83: =1+ A82 -> 82 | B83: EURASIP Journal on Image and Video Processing
A84: =1+ A83 -> 83 | B84: Euromoney
A85: =1+ A84 -> 84 | B85: European Journal of Operation Research
A86: =1+ A85 -> 85 | B86: ExIMP Times
A87: =1+ A86 -> 86 | B87: FEBS Letters
A88: =1+ A87 -> 87 | B88: Film Quarterly
A89: =1+ A88 -> 88 | B89: Finance India
A90: =1+ A89 -> 89 | B90: Fluid Phase Equilibria
A91: =1+ A90 -> 90 | B91: Foreign Trade Review
A92: =1+ A91 -> 91 | B92: Fortune International
A93: =1+ A92 -> 92 | B93: Gandhi Marg
A94: =1+ A93 -> 93 | B94: Gene News
A95: =1+ A94 -> 94 | B95: General Knowledge Today
A96: =1+ A95 -> 95 | B96: Geography and You
A97: =1+ A96 -> 96 | B97: Geophysical Research Letters
A98: =1+ A97 -> 97 | B98: GIS Development
A99: =1+ A98 -> 98 | B99: Global Business Review
A100: =1+ A99 -> 99 | B100: Global Journal of Flexible Systems Management
A101: =1+ A100 -> 100 | B101: Grassroots
A102: =1+ A101 -> 101 | B102: Hans
A103: =1+ A102 -> 102 | B103: Hard News
A104: =1+ A103 -> 103 | B104: Harvard Business Review
A105: =1+ A104 -> 104 | B105: Human Resource Management
A106: =1+ A105 -> 105 | B106: Hydrocarbon Processing
A107: =1+ A106 -> 106 | B107: IASLIC Bulletin
A108: =1+ A107 -> 107 | B108: ICFAI Journal of English Studies
A109: =1+ A108 -> 108 | B109: ICFAI Reader
A110: =1+ A109 -> 109 | B110: IETE Journal of Education
A111: =1+ A110 -> 110 | B111: IETE Journal of Research
A112: =1+ A111 -> 111 | B112: IETE Technical Review
A113: =1+ A112 -> 112 | B113: IIC Quarterly
A114: =1+ A113 -> 113 | B114: Impact
A115: =1+ A114 -> 114 | B115: Indian Architect & Builder
A116: =1+ A115 -> 115 | B116: Indian Banker
A117: =1+ A116 -> 116 | B117: Indian Concrete Journal
A118: =1+ A117 -> 117 | B118: Indian Journal of Biochemistry and Biophysics
A119: =1+ A118 -> 118 | B119: Indian Journal of Biotechnology
A120: =1+ A119 -> 119 | B120: Indian Journal of Chemical Technology
A121: =1+ A120 -> 120 | B121: Indian Journal of Chemistry - A: Inorganic, Physical, Theoretical and Analytical Chemistry
A122: =1+ A121 -> 121 | B122: Indian Journal of Chemistry- B: Organic and Medicinal Chemistry
A123: =1+ A122 -> 122 | B123: Indian Journal of Engineering and Materials Sciences
A124: =1+ A123 -> 123 | B124: Indian Journal of Environment Protection
A125: =1+ A124 -> 124 | B125: Indian Journal of Environment and Ecoplaning
A126: =1+ A125 -> 125 | B126: Indian Journal of Experimental Biology
A127: =1+ A126 -> 126 | B127: Indian Journal of Fertilizer
A128: =1+ A127 -> 127 | B128: Indian Journal of Heterocyclic Chemisrty
A129: =1+ A128 -> 128 | B129: Indian Journal of Library & Information Science
A130: =1+ A129 -> 129 | B130: Indian Journal of Marketing
A131: =1+ A130 -> 130 | B131: Indian Journal of Microbiology
A132: =1+ A131 -> 131 | B132: Indian Journal of Public Administration
A133: =1+ A132 -> 132 | B133: Indian Journal of Pure & Applied Physics
A134: =1+ A133 -> 133 | B134: Indian Journal of Pure and Applied Mathematics
A135: =1+ A134 -> 134 | B135: Indian Journal of Radio Space Physics
A136: =1+ A135 -> 135 | B136: Indian Journal of Training and Development
A137: =1+ A136 -> 136 | B137: Indian Literature
A138: =1+ A137 -> 137 | B138: Indian Managment
A139: =1+ A138 -> 138 | B139: Industrial Marketing Management
A140: =1+ A139 -> 139 | B140: Information System Research
A141: =1+ A140 -> 140 | B141: Information Technology and Libraries
A142: =1+ A141 -> 141 | B142: Inside Outside
A143: =1+ A142 -> 142 | B143: International Journal of Electronic Commerce
A144: =1+ A143 -> 143 | B144: International Journal of Image and Graphics
A145: =1+ A144 -> 144 | B145: International Journal of Rural Management
A146: =1+ A145 -> 145 | B146: International Journal of Sensor Networks
A147: =1+ A146 -> 146 | B147: International Journal of Web Services Research
A148: =1+ A147 -> 147 | B148: International Journal on E-Learning
A149: =1+ A148 -> 148 | B149: International Journal on Semantic Web and Information Systems
A150: =1+ A149 -> 149 | B150: Investor
A151: =1+ A150 -> 150 | B151: Journal of Advertising
A152: =1+ A151 -> 151 | B152: Journal of Advertising Research
A153: =1+ A152 -> 152 | B153: Journal of Applied Behavioral Science
A154: =1+ A153 -> 153 | B154: Journal of Applied Polymer Science
A155: =1+ A154 -> 154 | B155: Journal of Applied Psychology
A156: =1+ A155 -> 155 | B156: Journal of Architectural Education
A157: =1+ A156 -> 156 | B157: Journal of Biological Chemistry
A158: =1+ A157 -> 157 | B158: Journal of Biosciences
A159: =1+ A158 -> 158 | B159: Journal of Business Research
A160: =1+ A159 -> 159 | B160: Journal of Chemical Education
A161: =1+ A160 -> 160 | B161: Journal of Chemical Engineering of Japan
A162: =1+ A161 -> 161 | B162: Journal of Chemical Sciences
A163: =1+ A162 -> 162 | B163: Journal of Communication Practices
A164: =1+ A163 -> 163 | B164: Journal of Consumer Research
A165: =1+ A164 -> 164 | B165: Journal of Contemporary Thought
A166: =1+ A165 -> 165 | B166: Journal of Crystal Growth
A167: =1+ A166 -> 166 | B167: Journal of Development Studies
A168: =1+ A167 -> 167 | B168: Journal of Discrete Mathematical Sciences and Cryptography
A169: =1+ A168 -> 168 | B169: Journal of Energy Resources Technology
A170: =1+ A169 -> 169 | B170: Journal of Enterpreunership
A171: =1+ A170 -> 170 | B171: Journal of Environmental Engineering
A172: =1+ A171 -> 171 | B172: Journal of Environmental Science and Engineering (earlier as Indian Journal of Environmental Health)
A173: =1+ A172 -> 172 | B173: Journal of Experimental Botany
A174: =1+ A173 -> 173 | B174: Journal of Geophysical Research: Biogeosciences
A175: =1+ A174 -> 174 | B175: Journal of Global Mass Communication
A176: =1+ A175 -> 175 | B176: Journal of Human Values
A177: =1+ A176 -> 176 | B177: Journal of Indian Academy of Applied Psychology
A178: =1+ A177 -> 177 | B178: Journal of Indian Chemical Society
A179: =1+ A178 -> 178 | B179: Journal of Indian Institute of Architect
A180: =1+ A179 -> 179 | B180: Journal of Indian Writing in English
A181: =1+ A180 -> 180 | B181: Journal of Information & Optimization Sciences
A182: =1+ A181 -> 181 | B182: Journal of Institution of Chemists
A183: =1+ A182 -> 182 | B183: Journal of Institution of Engineers (Computer Science)
A184: =1+ A183 -> 183 | B184: Journal of Institution of Engineers (Environment Engineering)
A185: =1+ A184 -> 184 | B185: Journal of Intellectual Property Rights
A186: =1+ A185 -> 185 | B186: Journal of Intercultural Communication Resarch
A187: =1+ A186 -> 186 | B187: Journal of Interdisciplinary Mathematics
A188: =1+ A187 -> 187 | B188: Journal of International and Intercultural Communication
A189: =1+ A188 -> 188 | B189: Journal of International Communication
A190: =1+ A189 -> 189 | B190: Journal of International Marketing
A191: =1+ A190 -> 190 | B191: Journal of Landscape Architecture
A192: =1+ A191 -> 191 | B192: Journal of Librarianship & Information Science
A193: =1+ A192 -> 192 | B193: Journal of Library & Information Science
A194: =1+ A193 -> 193 | B194: Journal of Literature & Aesthetics
A195: =1+ A194 -> 194 | B195: Journal of Management
A196: =1+ A195 -> 195 | B196: Journal of Management Information Systems
A197: =1+ A196 -> 196 | B197: Journal of Marketing
A198: =1+ A197 -> 197 | B198: Journal of Marketing Research
A199: =1+ A198 -> 198 | B199: Journal of Membrane Science
A200: =1+ A199 -> 199 | B200: Journal of Nanoscience & Nanotechnology
A201: =1+ A200 -> 200 | B201: Journal of Poetry Society
A202: =1+ A201 -> 201 | B202: Journal of Retailing
A203: =1+ A202 -> 202 | B203: Journal of School Language Literature
A204: =1+ A203 -> 203 | B204: Journal of Scientific & Industrial Research
A205: =1+ A204 -> 204 | B205: Journal of Statistics & Management Systems
A206: =1+ A205 -> 205 | B206: Journal of the Academy of Marketing Science
A207: =1+ A206 -> 206 | B207: Journal of Ultra Scientist of Physical Sciences
A208: =1+ A207 -> 207 | B208: Journal of Web Semantics
A209: =1+ A208 -> 208 | B209: Journal of World Business
A210: =1+ A209 -> 209 | B210: Journalism & Mass Communication
A211: =1+ A210 -> 210 | B211: Katha Desh
A212: =1+ A211 -> 211 | B212: Kavya Bharti
A213: =1+ A212 -> 212 | B213: Kew Bulletin
A214: =1+ A213 -> 213 | B214: Library Journal
A215: =1+ A214 -> 214 | B215: Library Technology Report
A216: =1+ A215 -> 215 | B216: Long Range Planning
A217: =1+ A216 -> 216 | B217: Management & Change
A218: =1+ A217 -> 217 | B218: Management Review
A219: =1+ A218 -> 218 | B219: Management Science
A220: =1+ A219 -> 219 | B220: Management Today
A221: =1+ A220 -> 220 | B221: Marg
A222: =1+ A221 -> 221 | B222: Marketing Research
A223: =1+ A222 -> 222 | B223: Media Asia
A224: =1+ A223 -> 223 | B224: Medicinal and Aromatic Plants Abstracts
A225: =1+ A224 -> 224 | B225: MERI Journal of Education
A226: =1+ A225 -> 225 | B226: MIS Quarterly
A227: =1+ A226 -> 226 | B227: MIT Sloan Management Review
A228: =1+ A227 -> 227 | B228: Modern Fiction Studies
A229: =1+ A228 -> 228 | B229: Modern Physics Letters (A)
A230: =1+ A229 -> 229 | B230: Molecular Cellular Biology
A231: =1+ A230 -> 230 | B231: Molecular Plant Microbe Interactions
A232: =1+ A231 -> 231 | B232: National Geographic
A233: =1+ A232 -> 232 | B233: Nature
A234: =1+ A233 -> 233 | B234: Naya Granodaya
A235: =1+ A234 -> 234 | B235: Neural Computation
A236: =1+ A235 -> 235 | B236: New English Teacher
A237: =1+ A236 -> 236 | B237: New Quest
A238: =1+ A237 -> 237 | B238: New Scientist
A239: =1+ A238 -> 238 | B239: Newsweek
A240: =1+ A239 -> 239 | B240: Nonprofit and Voluntary Sector Quarterly
A241: =1+ A240 -> 240 | B241: Nonprofit Management and Leadership
A242: =1+ A241 -> 241 | B242: Online
A243: =1+ A242 -> 242 | B243: Open Magazine
A244: =1+ A243 -> 243 | B244: Operation Research
A245: =1+ A244 -> 244 | B245: Operations Research Letters
A246: =1+ A245 -> 245 | B246: Opsearch
A247: =1+ A246 -> 246 | B247: Outlook
A248: =1+ A247 -> 247 | B248: Parikatha
A249: =1+ A248 -> 248 | B249: PC World
A250: =1+ A249 -> 249 | B250: PCQuest
A251: =1+ A250 -> 250 | B251: Photonirvachak: Journal of Indian Society of Remote Sensing
A252: =1+ A251 -> 251 | B252: Physics Today
A253: =1+ A252 -> 252 | B253: Physics World
A254: =1+ A253 -> 253 | B254: Physiology & Molecular Biology of Plants
A255: =1+ A254 -> 254 | B255: Phytomophology
A256: =1+ A255 -> 255 | B256: Pitch
A257: =1+ A256 -> 256 | B257: Plant Journal
A258: =1+ A257 -> 257 | B258: Plant Cell
A259: =1+ A258 -> 258 | B259: Plant Physiology
A260: =1+ A259 -> 259 | B260: PMLA
A261: =1+ A260 -> 260 | B261: PNAS: Proceedings of the National Academy of Sciences
A262: =1+ A261 -> 261 | B262: Pollution Abstract
A263: =1+ A262 -> 262 | B263: Pollution Research
A264: =1+ A263 -> 263 | B264: Polymer International
A265: =1+ A264 -> 264 | B265: Popular Science
A266: =1+ A265 -> 265 | B266: Pragatisheel Vasudha
A267: =1+ A266 -> 266 | B267: Prajanan: Journal of Social and Management Sciences
A268: =1+ A267 -> 267 | B268: Pramana: Journal of Physics
A269: =1+ A268 -> 268 | B269: Pratiyogita Darpan
A270: =1+ A269 -> 269 | B270: Process Safety Progress
A271: =1+ A270 -> 270 | B271: RBI Bulletin
A272: =1+ A271 -> 271 | B272: REfocus Magazine
A273: =1+ A272 -> 272 | B273: Remote Sensing of Environment
A274: =1+ A273 -> 273 | B274: Resonance
A275: =1+ A274 -> 274 | B275: Samayantar
A276: =1+ A275 -> 275 | B276: Sambodhan
A277: =1+ A276 -> 276 | B277: Samkaalin Bhartiya Sahitya
A278: =1+ A277 -> 277 | B278: Samyukta
A279: =1+ A278 -> 278 | B279: Science
A280: =1+ A279 -> 279 | B280: Science and Society
A281: =1+ A280 -> 280 | B281: Science Reporter
A282: =1+ A281 -> 281 | B282: Scientific American
A283: =1+ A282 -> 282 | B283: Seminar
A284: =1+ A283 -> 283 | B284: Separation and Purification Technology
A285: =1+ A284 -> 284 | B285: Smart Photography
A286: =1+ A285 -> 285 | B286: Social Enterprise
A287: =1+ A286 -> 286 | B287: Society Interiors
A288: =1+ A287 -> 287 | B288: Software Testing,Verification and Reliability
A289: =1+ A288 -> 288 | B289: Software World
A290: =1+ A289 -> 289 | B290: Solar Energy Materials & Solar Cells
A291: =1+ A290 -> 290 | B291: South Asian Journal of Mangement
A292: =1+ A291 -> 291 | B292: SRELS Journal of Information Management
A293: =1+ A292 -> 292 | B293: Strategic Management Journal
A294: =1+ A293 -> 293 | B294: Sustainability Tomorrow
A295: =1+ A294 -> 294 | B295: Tadbhava
A296: =1+ A295 -> 295 | B296: Taxon
A297: =1+ A296 -> 296 | B297: Tehelka
A298: =1+ A297 -> 297 | B298: Teri Newswire
A299: =1+ A298 -> 298 | B299: The Chemical Engineer
A300: =1+ A299 -> 299 | B300: Time
A301: =1+ A300 -> 300 | B301: Times Higher Education Supplement
A302: =1+ A301 -> 301 | B302: Tohoku Mathematical Journal
A303: =1+ A302 -> 302 | B303: University News
A304: =1+ A303 -> 303 | B304: University Today
A305: =1+ A304 -> 304 | B305: Vartaman Sahitya
A306: =1+ A305 -> 305 | B306: Vidura
A307: =1+ A306 -> 306 | B307: Vidyut Bharti
A308: =1+ A307 -> 307 | B308: Vikalpa: The Journal for Decision Makers
A309: =1+ A308 -> 308 | B309: Vinimaya
A310: =1+ A309 -> 309 | B310: Vision
A311: =1+ A310 -> 310 | B311: Wasafiri
A312: =1+ A311 -> 311 | B312: Water Resources Research
A313: =1+ A312 -> 312 | B313: Yojana