B1: SAGE Communication & Media Studies Collection 2013
B2: 1999 till date
A4: S.No. | B4: SAGE Communication & Media Studies (36 E-Journals) | C4: URL | D4: Ranked/Awarded
A5: 1 | B5: Animation | C5: http://anm.sagepub.com/
A6: = A5+1 -> 2 | B6: Bioscope: South Asian Screen Studies | C6: http://bio.sagepub.com/
A7: = A6+1 -> 3 | B7: British Journalism Review | C7: http://bjr.sagepub.com/
A8: = A7+1 -> 4 | B8: Business Communication Quarterly | C8: http://bcq.sagepub.com/
A9: = A8+1 -> 5 | B9: Communication Research | C9: http://crx.sagepub.com/ | D9: 2.0139999999999998
A10: = A9+1 -> 6 | B10: Convergence | C10: http://con.sagepub.com/
A11: = A10+1 -> 7 | B11: Discourse & Communication | C11: http://dcm.sagepub.com/ | D11: 0.93899999999999995
A12: = A11+1 -> 8 | B12: Discourse Studies | C12: http://dis.sagepub.com/ | D12: 0.78700000000000003
A13: = A12+1 -> 9 | B13: European Journal of Communication | C13: http://ejc.sagepub.com/ | D13: 1.05
A14: = A13+1 -> 10 | B14: European Journal of Cultural Studies | C14: http://ecs.sagepub.com/ | D14: 0.314
A15: = A14+1 -> 11 | B15: Games and Culture | C15: http://gac.sagepub.com/ | D15: 0.39500000000000002
A16: = A15+1 -> 12 | B16: Global Media and Communication | C16: http://gmc.sagepub.com/
A17: = A16+1 -> 13 | B17: Information Visualization | C17: http://ivi.sagepub.com/ | D17: 0.88900000000000001
A18: = A17+1 -> 14 | B18: International Communication Gazette | C18: http://gaz.sagepub.com/
A19: = A18+1 -> 15 | B19: International Journal of Cultural Studies | C19: http://ics.sagepub.com/ | D19: 0.40899999999999997
A20: = A19+1 -> 16 | B20: International Journal of Press/Politics, The | C20: http://hij.sagepub.com/ | D20: 1.0649999999999999
A21: = A20+1 -> 17 | B21: Journal of Business and Technical Communication | C21: http://jbt.sagepub.com/ | D21: 0.56200000000000006
A22: = A21+1 -> 18 | B22: Journal of Communication Inquiry | C22: http://jci.sagepub.com/
A23: = A22+1 -> 19 | B23: Journal of Social and Personal Relationships | C23: http://spr.sagepub.com/ | D23: 1.2869999999999999
A24: = A23+1 -> 20 | B24: Journal of Visual Culture | C24: http://vcu.sagepub.com/ | D24: 9.6000000000000002E-2
A25: = A24+1 -> 21 | B25: Journalism | C25: http://jou.sagepub.com/
A26: = A25+1 -> 22 | B26: Journalism & Communication Monographs | C26: http://jmo.sagepub.com/
A27: = A26+1 -> 23 | B27: Journalism & Mass Communication Educator | C27: http://jmc.sagepub.com/
A28: = A27+1 -> 24 | B28: Journalism & Mass Communication Quarterly | C28: http://jmq.sagepub.com/ | D28: 0.54200000000000004
A29: = A28+1 -> 25 | B29: Management Communication Quarterly | C29: http://mcq.sagepub.com/ | D29: 0.875
A30: = A29+1 -> 26 | B30: Media, Culture & Society | C30: http://mcs.sagepub.com/ | D30: 1.14
A31: = A30+1 -> 27 | B31: Media, War & Conflict | C31: http://mwc.sagepub.com/
A32: = A31+1 -> 28 | B32: Memory Studies | C32: http://mss.sagepub.com/ | D32: 1.07
A33: = A32+1 -> 29 | B33: Mobile Media & Communication | C33: #N/A
A34: = A33+1 -> 30 | B34: New Media & Society | C34: http://nms.sagepub.com/ | D34: 1.3939999999999999
A35: = A34+1 -> 31 | B35: Public Relations Inquiry | C35: http://pri.sagepub.com/
A36: = A35+1 -> 32 | B36: Public Understanding of Science | C36: http://pus.sagepub.com/ | D36: 1.8660000000000001
A37: = A36+1 -> 33 | B37: Science Communication | C37: http://scx.sagepub.com/ | D37: 2.077
A38: = A37+1 -> 34 | B38: Television & New Media | C38: http://tvn.sagepub.com/ | D38: 0.219
A39: = A38+1 -> 35 | B39: Visual Communication | C39: http://vcj.sagepub.com/ | D39: 0.44700000000000001
A40: = A39+1 -> 36 | B40: Written Communication | C40: http://wcx.sagepub.com/ | D40: 1.0620000000000001